{
  "version": 1,
  "title": "lofi sketch",
  "bpm": 75,
  "key": "A minor",
  "bars": 2,
  "tracks": [
    {
      "id": "drums",
      "role": "drums",
      "instrument": "sampler",
      "sound": "lofi_kit",
      "gain": 0.9,
      "events": [
        { "step": 0,  "note": "C2",  "vel": 0.9 },
        { "step": 4,  "note": "F#2", "vel": 0.5 },
        { "step": 8,  "note": "D2",  "vel": 0.8 },
        { "step": 12, "note": "F#2", "vel": 0.5 },
        { "step": 16, "note": "C2",  "vel": 0.9 },
        { "step": 20, "note": "F#2", "vel": 0.5 },
        { "step": 24, "note": "D2",  "vel": 0.8 },
        { "step": 28, "note": "F#2", "vel": 0.5 }
      ]
    },
    {
      "id": "bass",
      "role": "bass",
      "instrument": "synth",
      "sound": "sine_bass",
      "gain": 0.8,
      "events": [
        { "step": 0,  "note": "A1", "dur": 8, "vel": 0.8 },
        { "step": 8,  "note": "A1", "dur": 8, "vel": 0.7 },
        { "step": 16, "note": "F1", "dur": 8, "vel": 0.8 },
        { "step": 24, "note": "G1", "dur": 8, "vel": 0.7 }
      ]
    },
    {
      "id": "pad",
      "role": "pad",
      "instrument": "synth",
      "sound": "soft_pad",
      "gain": 0.6,
      "events": [
        { "step": 0,  "note": "A3", "dur": 16, "vel": 0.5 },
        { "step": 16, "note": "F3", "dur": 16, "vel": 0.5 }
      ]
    }
  ]
}
